<!DOCTYPE frameset SYSTEM "framesetTR.dtd">
<frameset>

<predicate lemma="tüket">


<roleset id="tüket.01" name="Kullanarak, harcayarak yok etmek, bitirmek, yoğaltmak">
<roles>
<role descr="tüketen" f="" n="0" suffix="NOM"/>

<role descr="tüketilen" f="" n="1" suffix="ACC"/>

<note/>
</roles>

<example name="" src="" type="">
<inflection aspect="ns" form="ns" person="ns" tense="ns" voice="ns"/>
<text>Titreyen elleri baş ucundaki sürahiye gide gele içindeki suyu tüketmişti</text>


<note/>
<arg f="mnr" n="m" suffix="">Titreyen elleri baş ucundaki sürahiye gide gele</arg>
<arg f="" n="1" suffix="">içindeki suyu</arg>
<rel f="">tüketmişti</rel>
</example>

<note/>
</roleset>

<note/>
</predicate>

<note/>
</frameset>
