<!DOCTYPE frameset SYSTEM "framesetTR.dtd">
<frameset>

<predicate lemma="gevşe">


<roleset id="gevşe.01" name="Sertlik ve gerginliği bozulmak">
<roles>
<role descr="gevşeyen şey" f="" n="1" suffix="NOM">
<vnrole vncls="" vntheta="theme"/>
</role>



<note/>
</roles>

<example name="none" src="" type="">
<inflection aspect="ns" form="ns" person="ns" tense="ns" voice="ns"/>
<text>Ayakkabısının bağcıkları gevşemişti.</text>



<note/>
<arg f="" n="1" suffix="">Ayakkabısının bağcıkları</arg>
<rel f="">gevşemişti</rel>
</example>


<note/>
</roleset>


<note/>
</predicate>


<note/>
</frameset>
