<!DOCTYPE frameset SYSTEM "framesetTR.dtd">
<frameset>

<predicate lemma="hafifle">


<roleset id="hafifle.01" name="Eski ağırlığı azalmak">
<roles>
<role descr="hafifleyen" f="" n="1" suffix="NOM"/>


<note/>
</roles>


<note/>
</roleset>

<note/>
</predicate>

<note/>
</frameset>
