<!DOCTYPE frameset SYSTEM "framesetTR.dtd">
<frameset>

<predicate lemma="tutul">


<roleset id="tutul.01" name="aÅŸÄ±k olmak">
<roles>
<role descr="tutulan" f="" n="0" suffix="NOM">
<vnrole vncls="" vntheta="experiencer"/>
</role>

<role descr="neye tutulduÄŸu" f="" n="1" suffix="DAT">
<vnrole vncls="" vntheta="stimulus"/>
</role>
<note/>
</roles>

<note/>
<example name="" src="" type="">
<inflection aspect="ns" form="ns" person="ns" tense="ns" voice="ns"/>
<text>Ben sana tutuldum.</text>
<note/>
<arg f="" n="0" suffix="">Ben</arg>
<arg f="" n="1" suffix="">sana</arg>
<rel f="">tutuldum</rel>
</example>
</roleset>
<note/>
</predicate>
<note/>
</frameset>
