<!DOCTYPE frameset SYSTEM "framesetTR.dtd">
<frameset>

<predicate lemma="ılı">


<roleset id="ılı.01" name="Ilınmak">
<roles>
<role descr="ılık duruma gelen kişi/şey" f="" n="1" suffix="NOM">
<vnrole vncls="" vntheta="patient"/>
</role>



<note/>
</roles>

<example name="tnc-KA16B4A-0121" src="" type="">
<inflection aspect="ns" form="ns" person="ns" tense="ns" voice="ns"/>
<text>Kaynar su birazcık ılıdı.</text>



<note/>
<arg f="" n="1" suffix="">Kaynar su</arg>
<arg f="ext" n="m" suffix="">birazcık</arg>
<rel f="">ılıdı</rel>
</example>


<note/>
</roleset>


<note/>
</predicate>


<note/>
</frameset>
