<!DOCTYPE frameset SYSTEM "framesetTR.dtd">
<frameset>

<predicate lemma="kırıt">


<roleset id="kırıt.01" name="cilveli davranışlarda bulunmak">
<roles>
<role descr="kırıtan" f="" n="0" suffix="NOM">
<vnrole vncls="" vntheta="agent"/>
</role>



<note/>
</roles>



<note/>
</roleset>


<note/>
</predicate>


<note/>
</frameset>
