<!DOCTYPE frameset SYSTEM "framesetTR.dtd">
<frameset>

<predicate lemma="yan">


<roleset id="yan.01" name="Ateş durumuna geçmek, tutuşmak">
<roles>
<role descr="yanan" f="" n="1" suffix="NOM">
<vnrole vncls="" vntheta="patient"/>
</role>


<note/>
</roles>


<note/>
</roleset>

<note/>
</predicate>

<note/>
</frameset>
