<!DOCTYPE frameset SYSTEM "framesetTR.dtd">
<frameset>

<predicate lemma="boşan">


<roleset id="boşan.01" name="Ayrılmak">
<roles>
<role descr="boşanan" f="" n="0" suffix="NOM"/>

<role descr="kimden boşandığı" f="" n="3" suffix="ABL"/>
<note/>
</roles>

<note/>
<example name="" src="" type="">
<inflection aspect="ns" form="ns" person="ns" tense="ns" voice="ns"/>
<text>Sonunda ondan boşandım.</text>
<note/>
<arg f="adv" n="m" suffix="">Sonunda</arg>
<arg f="" n="3" suffix="">ondan</arg>
</example>
</roleset>
<note/>
</predicate>
<note/>
</frameset>
